Category,ID,Term,Genes,adj_pval
BP,GO:0030198,extracellular matrix organization,"LAMB3, SULF1, COL11A1, COL10A1, ANTXR1, MYO1E, FERMT1, MMP11, ERO1A, P4HA1, COL12A1, COL17A1, COL5A2, COL8A1, AEBP1, FAP, COL1A2, COMP, COL3A1, COL1A1, COL5A1, TGFBI, SULF2, LOXL1, POSTN, MATN3, SERPINB5, SERPINH1, CTSK, GREM1, OLFML2B, MMP12, COL4A2, PXDN, COL4A1, GAS2, LUM, MMP7, MMP1, HMCN1, MMP9, SFRP2, LOX, PRSS2",3.24E-19
BP,GO:0043062,extracellular structure organization,"LAMB3, SULF1, COL11A1, COL10A1, ANTXR1, MYO1E, FERMT1, MMP11, ERO1A, P4HA1, COL12A1, COL17A1, COL5A2, COL8A1, AEBP1, FAP, COL1A2, COMP, COL3A1, COL1A1, COL5A1, TGFBI, SULF2, LOXL1, POSTN, MATN3, SERPINB5, SERPINH1, CTSK, GREM1, OLFML2B, MMP12, COL4A2, PXDN, COL4A1, GAS2, LUM, MMP7, MMP1, HMCN1, MMP9, SFRP2, LOX, PRSS2",3.24E-19
BP,GO:0045229,external encapsulating structure organization,"LAMB3, SULF1, COL11A1, COL10A1, ANTXR1, MYO1E, FERMT1, MMP11, ERO1A, P4HA1, COL12A1, COL17A1, COL5A2, COL8A1, AEBP1, FAP, COL1A2, COMP, COL3A1, COL1A1, COL5A1, TGFBI, SULF2, LOXL1, POSTN, MATN3, SERPINB5, SERPINH1, CTSK, GREM1, OLFML2B, MMP12, COL4A2, PXDN, COL4A1, GAS2, LUM, MMP7, MMP1, HMCN1, MMP9, SFRP2, LOX, PRSS2",3.24E-19
BP,GO:0030199,collagen fibril organization,"COL11A1, MMP11, P4HA1, COL12A1, COL5A2, AEBP1, COL1A2, COMP, COL3A1, COL1A1, COL5A1, LOXL1, SERPINH1, GREM1, PXDN, LUM, SFRP2, LOX",1.84E-12
BP,GO:0042060,wound healing,"ITGA2, CDH3, MYOF, FN1, SDC1, CD9, FERMT1, PLAU, S100A10, CD109, FAP, PLAUR, PLAT, COMP, COL3A1, COL1A1, COL5A1, TIMP1, ACTA2, CEACAM1, P2RX1, ENTPD1, MMP12, FLNA, PDGFRB, F8, ANXA1, F5, F11, SERPINA1, LOX, EPB41L4B, SERPINB2, TSPAN8, DUOX2, KRT6A, REG3G, REG3A",8.38E-10
BP,GO:0010466,negative regulation of peptidase activity,"SLPI, CD109, CST1, SPOCK1, SFN, CST2, PLAUR, ANOS1, ECM1, TIMP1, COL6A3, CTSB, SERPINB5, SERPINH1, PI3, C5, BST2, IFI6, MMP9, SERPINA1, SFRP2, BIRC3, DPEP1, SERPINB2, SERPINI2, SERPINB3, RARRES1",2.89E-08
BP,GO:0045861,negative regulation of proteolysis,"SLPI, PLAU, CD109, CST1, SPOCK1, SFN, CST2, PLAUR, PLAT, ANOS1, ECM1, TIMP1, COL6A3, CTSB, SERPINB5, EPHA4, SERPINH1, PI3, C5, BST2, IFI6, IL1R2, MMP9, SERPINA1, SFRP2, BIRC3, DPEP1, SERPINB2, SERPINI2, SERPINB3, RARRES1",4.48E-08
BP,GO:0010951,negative regulation of endopeptidase activity,"SLPI, CD109, CST1, SPOCK1, SFN, CST2, PLAUR, ANOS1, TIMP1, COL6A3, SERPINB5, SERPINH1, PI3, C5, BST2, IFI6, MMP9, SERPINA1, SFRP2, BIRC3, DPEP1, SERPINB2, SERPINI2, SERPINB3, RARRES1",2.43E-07
BP,GO:0050878,regulation of body fluid levels,"ITGA2, MET, KCNN4, HK2, FN1, CD9, PLAU, ANO1, SFN, AGR2, FAP, PLAUR, PLAT, NPR3, OAS2, COMP, COL3A1, CEACAM1, P2RX1, ENTPD1, FLNA, F8, F5, CHRM3, F11, SERPINA1, SCNN1A, SERPINB2, TSPAN8, CEL, CFTR",4.44E-07
BP,GO:0032963,collagen metabolic process,"ITGA2, MMP11, FAP, COL1A2, COL1A1, COL5A1, CTSB, SERPINH1, CTSK, MMP12, PDGFRB, MMP7, INHBA, MMP1, MMP9, PRSS2",7.93E-07
BP,GO:0051346,negative regulation of hydrolase activity,"SLPI, CD109, CST1, SPOCK1, SFN, CST2, PLAUR, ANOS1, ECM1, TIMP1, COL6A3, CTSB, SERPINB5, SERPINH1, PI3, C5, BST2, RGN, IFI6, ANXA1, MMP9, SERPINA1, SFRP2, BIRC3, DPEP1, SERPINB2, SERPINI2, SERPINB3, RARRES1",2.14E-06
BP,GO:0035987,endodermal cell differentiation,"LAMB3, COL11A1, FN1, COL12A1, COL5A2, COL8A1, DKK1, COL5A1, COL4A2, INHBA, MMP9",2.90E-06
BP,GO:1903034,regulation of response to wounding,"CD9, FERMT1, PLAU, CD109, FAP, PLAUR, PLAT, EPHA4, ACTA2, CEACAM1, FLNA, ANXA1, F11, SERPINB2, TSPAN8, DUOX2, SPP1, REG3G, REG3A",3.34E-06
BP,GO:0052547,regulation of peptidase activity,"SLPI, FN1, ANTXR1, CD109, CST1, SPOCK1, SFN, EGLN3, CST2, PLAUR, ANOS1, ECM1, TIMP1, COL6A3, CTSB, SERPINB5, EPHA4, SERPINH1, PI3, P2RX1, C5, BST2, IFI6, MMP9, SERPINA1, SFRP2, BIRC3, DPEP1, SERPINB2, SERPINI2, SERPINB3, RARRES1",3.75E-06
BP,GO:0007586,digestion,"KCNN4, NPC1, NPR3, GCNT3, TFF1, VSIG1, CHRM3, MUC13, PBLD, PLS1, PNLIPRP2, CLPS, TFF2, PRSS3, CEL, PNLIP, PRSS2",3.79E-06
BP,GO:0019730,antimicrobial humoral response,"SLPI, PI3, CXCL5, CXCL8, CXCL10, LYZ, KRT6A, LGALS4, PRSS3, PLA2G1B, DMBT1, REG1A, REG1B, PRSS2, REG3G, REG3A",4.96E-06
BP,GO:0001706,endoderm formation,"LAMB3, COL11A1, FN1, COL12A1, COL5A2, COL8A1, DKK1, COL5A1, COL4A2, INHBA, MMP9",1.30E-05
BP,GO:0061448,connective tissue development,"MBOAT2, SULF1, COL11A1, BGN, ECM1, COMP, COL3A1, COL1A1, COL5A1, TGFBI, SULF2, CRIP1, TIMP1, MATN3, SERPINH1, ACTA2, CTSK, GREM1, PDGFRB, PRRX1, SFRP2, LOX, EPYC",1.30E-05
BP,GO:0061041,regulation of wound healing,"CD9, FERMT1, PLAU, CD109, FAP, PLAUR, PLAT, ACTA2, CEACAM1, ANXA1, F11, SERPINB2, TSPAN8, DUOX2, REG3G, REG3A",1.56E-05
BP,GO:0043588,skin development,"ITGA2, CDH3, MET, ITGA3, FERMT1, TRIM16, ITGB4, ADAM9, CD109, COL5A2, SFN, FOXQ1, COL1A2, DKK1, COMP, COL3A1, COL1A1, COL5A1, IGFBP5, ANXA1, INHBA, KRT6A, REG3G, REG3A",1.69E-05
BP,GO:0001704,formation of primary germ layer,"LAMB3, ITGA2, COL11A1, FN1, ITGA3, ITGB4, COL12A1, COL5A2, COL8A1, DKK1, COL5A1, COL4A2, INHBA, MMP9, SFRP2",3.04E-05
BP,GO:1900047,negative regulation of hemostasis,"CD9, PLAU, FAP, PLAUR, PLAT, COMP, CEACAM1, F11, SERPINB2, TSPAN8",3.04E-05
BP,GO:0031589,cell-substrate adhesion,"LAMB3, ITGA2, FN1, ITGA3, CEACAM6, ANTXR1, FERMT1, PLAU, ITGB4, S100A10, ADAM9, ACTN1, COL17A1, SPOCK1, COL8A1, AGR2, MSLN, COL3A1, COL1A1, GREM1, ID1, MMP12, FLNA, EDIL3, THY1, OLFM4",4.57E-05
BP,GO:0044278,cell wall disruption in another organism,"REG1A, REG1B, REG3G, REG3A",4.60E-05
BP,GO:0052548,regulation of endopeptidase activity,"SLPI, CD109, CST1, SPOCK1, SFN, EGLN3, CST2, PLAUR, ANOS1, TIMP1, COL6A3, SERPINB5, EPHA4, SERPINH1, PI3, P2RX1, C5, BST2, IFI6, MMP9, SERPINA1, SFRP2, BIRC3, DPEP1, SERPINB2, SERPINI2, SERPINB3, RARRES1",6.57E-05
BP,GO:0030574,collagen catabolic process,"MMP11, FAP, CTSB, CTSK, MMP12, MMP7, MMP1, MMP9, PRSS2",9.14E-05
BP,GO:0051216,cartilage development,"MBOAT2, SULF1, COL11A1, BGN, ECM1, COMP, COL3A1, COL1A1, TGFBI, SULF2, TIMP1, MATN3, SERPINH1, CTSK, GREM1, PRRX1, SFRP2, EPYC",9.69E-05
BP,GO:0001667,ameboidal-type cell migration,"ITGA2, MET, FN1, ITGA3, FERMT1, EDNRA, ITGB4, ADAM9, ANLN, S100P, EFNB2, FAP, SRPX2, ANXA3, PTPRR, SPARC, TIMP1, ACTA2, CEACAM1, GREM1, ID1, ANXA1, PAK3, SEMA3C, EGF, MMP9, EPB41L4B, RAB25, S100A2, PRSS3",9.94E-05
BP,GO:0022600,digestive system process,"KCNN4, NPC1, NPR3, GCNT3, TFF1, VSIG1, CHRM3, MUC13, PBLD, PLS1, TFF2, CEL, PNLIP",0.00010003
BP,GO:0007596,blood coagulation,"ITGA2, FN1, CD9, PLAU, FAP, PLAUR, PLAT, COMP, COL3A1, CEACAM1, P2RX1, ENTPD1, FLNA, F8, F5, F11, SERPINA1, SERPINB2, TSPAN8",0.000104581
BP,GO:0019058,viral life cycle,"TMPRSS4, ITGA2, SLPI, TRIM59, IFI27, LY6E, EFNB2, CD55, NPC1, OAS1, OAS2, TOP2A, RSAD2, CTSB, LGALS1, MX1, CDK1, BST2, ANPEP, TRIM31, CXCL8, NR5A2, SERPINB3",0.000114518
BP,GO:0050817,coagulation,"ITGA2, FN1, CD9, PLAU, FAP, PLAUR, PLAT, COMP, COL3A1, CEACAM1, P2RX1, ENTPD1, FLNA, F8, F5, F11, SERPINA1, SERPINB2, TSPAN8",0.000133344
BP,GO:0071711,basement membrane organization,"LAMB3, FERMT1, MMP11, COL3A1, PXDN, COL4A1, GAS2, HMCN1",0.000133344
BP,GO:0007599,hemostasis,"ITGA2, FN1, CD9, PLAU, FAP, PLAUR, PLAT, COMP, COL3A1, CEACAM1, P2RX1, ENTPD1, FLNA, F8, F5, F11, SERPINA1, SERPINB2, TSPAN8",0.000137606
BP,GO:1903035,negative regulation of response to wounding,"CD9, PLAU, CD109, FAP, PLAUR, PLAT, EPHA4, CEACAM1, F11, SERPINB2, TSPAN8, SPP1",0.000145213
BP,GO:0030195,negative regulation of blood coagulation,"CD9, PLAU, FAP, PLAUR, PLAT, CEACAM1, F11, SERPINB2, TSPAN8",0.000169284
BP,GO:0060249,anatomical structure homeostasis,"NOX4, CDH3, PDK4, SLC2A1, OAS1, COMP, COL3A1, CLDN18, P2RX1, CTSK, TFF1, ALB, VSIG1, LOX, IAPP, MUC13, HOMER2, PBLD, SCGN, LYZ, SPP1, AZGP1, TFF2",0.000200895
BP,GO:0007492,endoderm development,"LAMB3, COL11A1, FN1, COL12A1, COL5A2, COL8A1, DKK1, COL5A1, COL4A2, INHBA, MMP9",0.000258074
BP,GO:0044409,entry into host,"TMPRSS4, ITGA2, TRIM59, LY6E, EFNB2, CD55, NPC1, CTSB, LGALS1, CDK1, ANPEP, TRIM31, CXCL8, SERPINB3, KRT6A",0.000285199
BP,GO:0050819,negative regulation of coagulation,"CD9, PLAU, FAP, PLAUR, PLAT, CEACAM1, F11, SERPINB2, TSPAN8",0.000299079
BP,GO:0043434,response to peptide hormone,"PKM, TRIM16, EDNRA, GJB2, PDK4, RAB31, BTG2, PLAT, SLC2A1, COL3A1, COL1A1, TIMP1, CEACAM1, CTSK, IGFBP5, TFF1, ANXA1, FBN1, INHBA, SCNN1A, GRB14, PLA2G1B, REG1A, REG1B, REG3G, REG3A",0.000307721
BP,GO:1903900,regulation of viral life cycle,"TMPRSS4, SLPI, TRIM59, LY6E, OAS1, OAS2, TOP2A, RSAD2, LGALS1, MX1, BST2, TRIM31, CXCL8, NR5A2",0.000367613
BP,GO:0090130,tissue migration,"ITGA2, MET, ITGA3, FERMT1, ADAM9, ANLN, S100P, EFNB2, FAP, SRPX2, ANXA3, PTPRR, SPARC, ACTA2, CEACAM1, GREM1, ID1, ANXA1, EGF, MMP9, EPB41L4B, RAB25, S100A2, PRSS3",0.000370757
BP,GO:0001894,tissue homeostasis,"NOX4, CDH3, PDK4, SLC2A1, OAS1, COMP, COL3A1, CLDN18, CTSK, TFF1, ALB, VSIG1, IAPP, MUC13, HOMER2, PBLD, LYZ, SPP1, AZGP1, TFF2",0.000373571
BP,GO:1900046,regulation of hemostasis,"CD9, PLAU, FAP, PLAUR, PLAT, COMP, CEACAM1, F11, SERPINB2, TSPAN8",0.00041209
BP,GO:0060348,bone development,"SULF1, BGN, TGM2, ECM1, COMP, TFAP2A, COL3A1, COL1A1, CLDN18, SULF2, SERPINH1, GREM1, FLNA, RGN, FBN1, LOX, SFRP4, EPYC",0.000475879
BP,GO:0010038,response to metal ion,"ECT2, S100A16, NQO1, SDC1, ADAM9, NPC1, TFAP2A, TTN, CRIP1, ALOX5AP, CDK1, MT1G, TFF1, BACE1, MT1M, MT1F, BNIP3, MMP9, DPEP1, IGFBP2, IMPA2, CPA1, FABP4",0.000583439
BP,GO:0002063,chondrocyte development,"SULF1, COL11A1, ECM1, COMP, SULF2, SERPINH1, SFRP2",0.000622984
BP,GO:0010631,epithelial cell migration,"ITGA2, MET, ITGA3, FERMT1, ADAM9, ANLN, S100P, EFNB2, FAP, SRPX2, ANXA3, PTPRR, SPARC, CEACAM1, GREM1, ID1, ANXA1, EGF, MMP9, EPB41L4B, RAB25, S100A2, PRSS3",0.000733529
BP,GO:0007369,gastrulation,"LAMB3, ITGA2, COL11A1, FN1, ITGA3, ITGB4, COL12A1, COL5A2, COL8A1, IL1RN, DKK1, COL5A1, COL4A2, INHBA, MMP9, SFRP2",0.000736292
BP,GO:0061045,negative regulation of wound healing,"CD9, PLAU, CD109, FAP, PLAUR, PLAT, CEACAM1, F11, SERPINB2, TSPAN8",0.000758366
BP,GO:0090132,epithelium migration,"ITGA2, MET, ITGA3, FERMT1, ADAM9, ANLN, S100P, EFNB2, FAP, SRPX2, ANXA3, PTPRR, SPARC, CEACAM1, GREM1, ID1, ANXA1, EGF, MMP9, EPB41L4B, RAB25, S100A2, PRSS3",0.000789396
BP,GO:0048771,tissue remodeling,"NOX4, EDNRA, CTHRC1, PDK4, CLDN18, TIMP1, CEACAM1, CTSK, GREM1, FLNA, IGFBP5, GPNMB, SEMA3C, IAPP, SPP1",0.00097248
BP,GO:0061844,antimicrobial humoral immune response mediated by antimicrobial peptide,"CXCL5, CXCL8, CXCL10, KRT6A, LGALS4, PLA2G1B, REG1A, REG1B, REG3G, REG3A",0.001008012
BP,GO:0044000,movement in host,"TMPRSS4, ITGA2, TRIM59, LY6E, EFNB2, CD55, NPC1, CTSB, LGALS1, CDK1, ANPEP, TRIM31, CXCL8, SERPINB3, KRT6A",0.001221332
BP,GO:0050792,regulation of viral process,"TMPRSS4, SLPI, TRIM59, LY6E, OAS1, OAS2, TOP2A, RSAD2, LGALS1, MX1, BST2, TRIM31, CXCL8, NR5A2",0.001271944
BP,GO:0007178,"transmembrane receptor protein serine, threonine kinase signaling pathway","SULF1, ITGA3, FERMT1, ADAM9, CD109, LTBP1, COL1A2, DKK1, PMEPA1, COMP, COL3A1, GREM1, ID1, ASPN, TNFAIP6, SLC39A5, FBN1, INHBA, SFRP2, LOX, SFRP4, PBLD, HPGD",0.001746737
BP,GO:0042730,fibrinolysis,"PLAU, FAP, PLAUR, PLAT, F11, SERPINB2",0.001815134
BP,GO:0030193,regulation of blood coagulation,"CD9, PLAU, FAP, PLAUR, PLAT, CEACAM1, F11, SERPINB2, TSPAN8",0.001815134
BP,GO:0043616,keratinocyte proliferation,"CDH3, FERMT1, SDR16C5, CD109, SFN, EFNB2, REG3G, REG3A",0.002044235
BP,GO:0045785,positive regulation of cell adhesion,"ITGA2, FN1, ITGA3, CEACAM6, FERMT1, S100A10, ADAM9, TNFSF4, COL8A1, EFNB2, AGR2, CD55, TGM2, PLAUR, EPHA4, LGALS1, FLNA, EDIL3, IL2RG, ANXA1, THY1, SFRP2, EPB41L4B, IGFBP2, OLFM4, PRSS2",0.002400502
BP,GO:0046718,viral entry into host cell,"TMPRSS4, ITGA2, TRIM59, LY6E, EFNB2, CD55, NPC1, CTSB, LGALS1, CDK1, ANPEP, TRIM31, SERPINB3",0.002400502
BP,GO:0006959,humoral immune response,"SLPI, CD55, TNFRSF21, PI3, C5, CXCL5, CXCL8, CXCL10, LYZ, KRT6A, LGALS4, C6, PRSS3, PLA2G1B, DMBT1, REG1A, REG1B, PRSS2, REG3G, REG3A",0.002409828
BP,GO:0051917,regulation of fibrinolysis,"PLAU, FAP, PLAUR, PLAT, F11",0.002549861
BP,GO:0010810,regulation of cell-substrate adhesion,"FN1, ITGA3, CEACAM6, FERMT1, PLAU, S100A10, SPOCK1, COL8A1, AGR2, COL1A1, GREM1, MMP12, FLNA, EDIL3, THY1, OLFM4",0.002658866
BP,GO:0050818,regulation of coagulation,"CD9, PLAU, FAP, PLAUR, PLAT, CEACAM1, F11, SERPINB2, TSPAN8",0.002843177
BP,GO:0007229,integrin-mediated signaling pathway,"ITGA2, FN1, ITGA3, FERMT1, ITGB4, ADAM9, COL3A1, TIMP1, CEACAM1, FLNA, THY1",0.002914823
BP,GO:0009636,response to toxic substance,"SLC6A14, NQO1, SDC1, EPHX2, EPHX1, AHR, GPX8, ALOX5AP, CDK1, PDGFRB, GPX2, MT1G, PXDN, MT1M, MT1F, ALB, DUOX2",0.003056821
BP,GO:0002062,chondrocyte differentiation,"MBOAT2, SULF1, COL11A1, ECM1, COMP, COL3A1, TGFBI, SULF2, SERPINH1, GREM1, SFRP2",0.003071466
BP,GO:0051701,biological process involved in interaction with host,"TMPRSS4, ITGA2, TRIM59, LY6E, EFNB2, CD55, NPC1, CTSB, LGALS1, CDK1, ANPEP, TRIM31, CXCL8, SERPINB3, KRT6A",0.003188619
BP,GO:0071559,response to transforming growth factor beta,"ITGA3, FERMT1, ADAM9, CD109, LTBP1, COL1A2, MXRA5, PMEPA1, COL3A1, COL1A1, CTSK, ID1, ASPN, COL4A2, FBN1, LOX, PBLD, HPGD",0.003188619
BP,GO:0001655,urogenital system development,"SULF1, ITGA3, SDC1, MYO1E, EDNRA, EFNB2, TFAP2A, SULF2, CRIP1, SERPINB5, EPHA4, ACTA2, GREM1, GCNT3, PDGFRB, RGN, COL4A1, ANXA1, FBN1, MMP9, HPGD",0.003678595
BP,GO:0044403,biological process involved in symbiotic interaction,"TMPRSS4, ITGA2, APOL1, TRIM59, FN1, IFI27, LY6E, EFNB2, CD55, NPC1, CTSB, LGALS1, CDK1, ANPEP, TRIM31, CXCL8, ST6GALNAC1, SERPINB3, KRT6A",0.00372321
BP,GO:0022617,extracellular matrix disassembly,"MMP11, FAP, CTSK, MMP12, MMP7, MMP1, MMP9, PRSS2",0.004004491
BP,GO:0051604,protein maturation,"TMPRSS4, CTSE, FN1, PLAU, S100A10, ERO1A, PLAUR, PLAT, COMP, SEC11C, CORIN, SERPINH1, FLNA, IL1R2, BACE1, F8, F11, KLK1, PLA2G7, PRSS3",0.004004491
BP,GO:0044703,multi-organism reproductive process,"ITGA2, ITGA3, GJB2, ITGB4, SLC2A1, CORIN, TIMP1, CTSB, P2RX1, IGFBP5, MMP9, IGFBP2, EPYC, HPGD, SPP1",0.004153254
BP,GO:0016032,viral process,"TMPRSS4, ITGA2, SLPI, TRIM59, IFI27, LY6E, EFNB2, CD55, NPC1, OAS1, OAS2, TOP2A, RSAD2, CTSB, LGALS1, MX1, CDK1, BST2, ANPEP, TRIM31, CXCL8, NR5A2, SERPINB3",0.004212597
BP,GO:0007565,female pregnancy,"ITGA2, ITGA3, GJB2, ITGB4, SLC2A1, CORIN, TIMP1, CTSB, IGFBP5, MMP9, IGFBP2, EPYC, HPGD, SPP1",0.00501812
BP,GO:0007160,cell-matrix adhesion,"ITGA2, FN1, ITGA3, CEACAM6, FERMT1, PLAU, ITGB4, S100A10, ADAM9, ACTN1, COL17A1, MSLN, COL3A1, GREM1, MMP12, THY1",0.005020621
BP,GO:0048333,mesodermal cell differentiation,"ITGA2, ITGA3, ITGB4, DKK1, INHBA, SFRP2",0.005249895
BP,GO:0030277,maintenance of gastrointestinal epithelium,"TFF1, VSIG1, MUC13, PBLD, TFF2",0.00568623
BP,GO:0030728,ovulation,"PLAT, TNFAIP6, GAS2, INHBA, HPGD",0.00568623
BP,GO:0043589,skin morphogenesis,"ITGA2, ITGB4, COL1A2, COL1A1",0.00571436
BP,GO:0010811,positive regulation of cell-substrate adhesion,"FN1, ITGA3, CEACAM6, FERMT1, S100A10, COL8A1, AGR2, FLNA, EDIL3, THY1, OLFM4",0.005854564
BP,GO:0044706,multi-multicellular organism process,"ITGA2, ITGA3, GJB2, ITGB4, SLC2A1, CORIN, TIMP1, CTSB, P2RX1, IGFBP5, MMP9, IGFBP2, EPYC, HPGD, SPP1",0.005966707
BP,GO:1901655,cellular response to ketone,"FBXO32, GJB2, TNFSF4, AHR, PLAT, POSTN, MSN, SCNN1A, SPP1, CFTR",0.006073884
BP,GO:0071560,cellular response to transforming growth factor beta stimulus,"ITGA3, FERMT1, ADAM9, CD109, LTBP1, COL1A2, PMEPA1, COL3A1, COL1A1, CTSK, ID1, ASPN, COL4A2, FBN1, LOX, PBLD, HPGD",0.006451812
BP,GO:0018149,peptide cross-linking,"FN1, BGN, TGM2, COL3A1, PI3, ANXA1",0.006658844
BP,GO:0045069,regulation of viral genome replication,"SLPI, OAS1, OAS2, TOP2A, RSAD2, MX1, BST2, CXCL8, NR5A2",0.006759955
BP,GO:0046683,response to organophosphorus,"SDC1, TRIM16, AHR, PLAT, COL1A1, P2RX1, IGFBP5, NT5E, AQP8, DUOX2, CFTR",0.006759955
BP,GO:0033627,cell adhesion mediated by integrin,"ITGA2, ITGA3, FERMT1, PLAU, ITGB4, ADAM9, FBN1, SFRP2, MUC1",0.007287655
BP,GO:0016485,protein processing,"TMPRSS4, CTSE, PLAU, S100A10, ERO1A, PLAUR, PLAT, COMP, SEC11C, CORIN, IL1R2, BACE1, F11, KLK1, PLA2G7, PRSS3",0.007638084
BP,GO:0052372,modulation by symbiont of entry into host,"TMPRSS4, TRIM59, LY6E, LGALS1, TRIM31, CXCL8, KRT6A",0.007930569
BP,GO:0008544,epidermis development,"LAMC2, LAMB3, CDH3, FERMT1, TRIM16, ADAM9, CD109, COL17A1, SFN, FOXQ1, DKK1, MCOLN3, IGFBP5, ANXA1, INHBA, SFRP4, PLS1, KRT6A, REG3G, REG3A",0.008752372
BP,GO:0042572,retinol metabolic process,"SDR16C5, DHRS9, CYP2C18, ADH1B, CYP3A5, CEL, PNLIP",0.008752372
BP,GO:0048525,negative regulation of viral process,"SLPI, TRIM59, LY6E, OAS1, OAS2, RSAD2, MX1, BST2, TRIM31",0.008848759
BP,GO:2000117,negative regulation of cysteine-type endopeptidase activity,"CST1, SFN, CST2, PLAUR, IFI6, MMP9, SFRP2, BIRC3, DPEP1",0.008848759
BP,GO:0050673,epithelial cell proliferation,"SULF1, CDH3, FERMT1, SDR16C5, IGFBP3, CD109, SFN, COL8A1, EFNB2, FAP, SGPP2, ECM1, SPARC, SERPINB5, CEACAM1, ID1, MMP12, IGFBP5, RGN, EGF, SFRP2, FGL1, REG3G, REG3A",0.009254335
BP,GO:0035989,tendon development,"COL11A1, COMP, COL5A1",0.009658544
BP,GO:0032941,secretion by tissue,"KCNN4, ANO1, AGR2, NPR3, CHRM3, CEL",0.010717798
BP,GO:0035821,modulation of process of another organism,"SLPI, REG1A, REG1B, REG3G, REG3A",0.010721738
BP,GO:0001503,ossification,"COL11A1, VCAN, IGFBP3, CDH11, COL5A2, CTHRC1, COL1A2, DKK1, ECM1, COMP, TFAP2A, COL1A1, FHL2, CTSK, GREM1, ASPN, TNFAIP6, IGFBP5, MMP9, SFRP2, LOX, SPP1",0.011175484
BP,GO:0072001,renal system development,"SULF1, ITGA3, SDC1, MYO1E, EDNRA, EFNB2, TFAP2A, SULF2, EPHA4, ACTA2, GREM1, GCNT3, PDGFRB, RGN, COL4A1, FBN1, MMP9, HPGD",0.01242916
BP,GO:0014829,vascular associated smooth muscle contraction,"EDNRA, COMP, ACTA2, P2RX1, CHRM3",0.01242916
BP,GO:0031639,plasminogen activation,"PLAU, S100A10, PLAUR, PLAT, F11",0.01242916
BP,GO:1903036,positive regulation of response to wounding,"FERMT1, PLAU, PLAT, FLNA, ANXA1, DUOX2, REG3G, REG3A",0.013067162
BP,GO:0071604,transforming growth factor beta production,"CDH3, FN1, FERMT1, LTBP1, COL3A1, LUM",0.013067162
BP,GO:0051146,striated muscle cell differentiation,"NOX4, KRT19, MYOF, SDC1, CD9, CEACAM5, EFNB2, DKK1, FHL2, TTN, GREM1, CDK1, PDGFRB, IGFBP5, KLF5, ADAM12, CXCL10",0.013067162
BP,GO:0019221,cytokine-mediated signaling pathway,"IFI27, IL1RAP, MST1R, IL1RN, OAS1, OAS2, ECM1, CLDN18, LIFR, CCL20, CEACAM1, MX1, MMP12, PXDN, IL2RG, IL1R2, CXCL5, CXCL8, BIRC3, DUOX2, CXCL10, IL22RA1, CCL18, TFF2",0.013067162
BP,GO:0043903,regulation of biological process involved in symbiotic interaction,"TMPRSS4, TRIM59, LY6E, LGALS1, TRIM31, CXCL8, KRT6A",0.013245013
BP,GO:0042445,hormone metabolic process,"SDR16C5, ERO1A, CORIN, CTSB, CTSK, DHRS9, SLC16A10, DUOX2, CYP2C18, PLA2G7, ADH1B, CYP3A5, SPP1, CEL, PNLIP",0.013635537
BP,GO:0009615,response to virus,"IFI27, MST1R, TNFSF4, DDX60, OAS1, OAS2, RSAD2, MX2, IFI44, ACTA2, IFI44L, MX1, MMP12, BST2, IFI6, BNIP3, BIRC3, GBP3, DUOX2, CXCL10, DMBT1",0.013664653
BP,GO:0042692,muscle cell differentiation,"NOX4, KRT19, MYOF, SDC1, CD9, CEACAM5, EDNRA, ACTN1, EFNB2, DKK1, COMP, FHL2, TTN, GREM1, CDK1, PDGFRB, IGFBP5, KLF5, LOX, ADAM12, CXCL10",0.013664653
BP,GO:0007179,transforming growth factor beta receptor signaling pathway,"ITGA3, FERMT1, ADAM9, CD109, LTBP1, COL1A2, PMEPA1, COL3A1, ID1, ASPN, FBN1, LOX, PBLD, HPGD",0.013715624
BP,GO:0046686,response to cadmium ion,"NPC1, CDK1, MT1G, MT1M, MT1F, MMP9, CPA1",0.013715624
BP,GO:0006735,NADH regeneration,"PKM, HK2, ENO2, PFKP",0.013715624
BP,GO:0061621,canonical glycolysis,"PKM, HK2, ENO2, PFKP",0.013715624
BP,GO:0061718,glucose catabolic process to pyruvate,"PKM, HK2, ENO2, PFKP",0.013715624
BP,GO:0070106,interleukin-27-mediated signaling pathway,"OAS1, OAS2, MX1",0.013715624
BP,GO:1903224,regulation of endodermal cell differentiation,"COL5A2, DKK1, COL5A1",0.013715624
BP,GO:0072507,divalent inorganic cation homeostasis,"EDNRA, ERO1A, TGM2, MCOLN3, SLC39A10, S100A14, P2RX1, FLNA, RGN, NT5E, MT1G, SLC39A5, MT1M, MT1F, THY1, BNIP3, CXCL10, SCGN, CTRC",0.015117946
BP,GO:0034698,response to gonadotropin,"ITGA3, EDNRA, GJB2, PLAT, INHBA",0.01517427
BP,GO:0090303,positive regulation of wound healing,"FERMT1, PLAU, PLAT, ANXA1, DUOX2, REG3G, REG3A",0.016133757
BP,GO:0038065,collagen-activated signaling pathway,"ITGA2, COL1A1, COL4A2, COL4A1",0.016845353
BP,GO:0006875,cellular metal ion homeostasis,"EDNRA, ERO1A, TGM2, MCOLN3, SLC39A10, P2RX1, LCN2, TMPRSS3, FLNA, RGN, MT1G, SLC39A5, MT1M, CP, MT1F, THY1, BNIP3, SCNN1A, CXCL10, SCGN, CTRC",0.017519381
BP,GO:0014846,esophagus smooth muscle contraction,"SULF1, SULF2",0.017836504
BP,GO:0018277,protein deamination,"TGM2, LOXL1",0.017836504
BP,GO:0048817,negative regulation of hair follicle maturation,"CDH3, FERMT1",0.017836504
BP,GO:0010837,regulation of keratinocyte proliferation,"CDH3, CD109, SFN, EFNB2, REG3G, REG3A",0.017994282
BP,GO:0085029,extracellular matrix assembly,"LAMB3, ANTXR1, COL1A2, COL3A1, PXDN, LOX",0.017994282
BP,GO:0097205,renal filtration,"SULF1, ITGA3, MYO1E, EDNRA, SULF2",0.019498571
BP,GO:0001822,kidney development,"SULF1, ITGA3, SDC1, MYO1E, EDNRA, EFNB2, TFAP2A, SULF2, EPHA4, ACTA2, GREM1, GCNT3, PDGFRB, RGN, FBN1, MMP9, HPGD",0.019548182
BP,GO:0010634,positive regulation of epithelial cell migration,"ITGA2, MET, ITGA3, ADAM9, SRPX2, ANXA3, SPARC, ANXA1, EGF, MMP9, EPB41L4B, RAB25",0.019548182
BP,GO:0010755,regulation of plasminogen activation,"PLAU, S100A10, PLAUR, PLAT",0.019548182
BP,GO:0061620,glycolytic process through glucose-6-phosphate,"PKM, HK2, ENO2, PFKP",0.019548182
BP,GO:0050900,leukocyte migration,"ITGA2, ITGA3, CD9, ECM1, S100A14, CCL20, GREM1, C5, TNFAIP6, ANXA1, MSN, THY1, CXCL5, CXCL8, MMP9, CXCL10, PLA2G7, CCL18, GP2, PLA2G1B",0.020507141
BP,GO:0060840,artery development,"EDNRA, EFNB2, COMP, COL3A1, LOXL1, PDGFRB, PRRX1, LOX, HPGD",0.021030617
BP,GO:0019079,viral genome replication,"SLPI, IFI27, OAS1, OAS2, TOP2A, RSAD2, MX1, BST2, CXCL8, NR5A2",0.021084636
BP,GO:0042542,response to hydrogen peroxide,"ECT2, MET, NQO1, SDC1, ADAM9, COL1A1, CDK1, PDGFRB, ANXA1, BNIP3",0.021084636
BP,GO:0034329,cell junction assembly,"ITGA2, ECT2, FN1, AMIGO2, THBS2, CD9, IL1RAP, GJB2, ITGB4, CDH11, S100A10, ACTN1, COL17A1, EFNB2, DKK1, LRRN1, SRPX2, CLDN18, GREM1, THY1, NRCAM",0.021084636
BP,GO:0010669,epithelial structure maintenance,"TFF1, VSIG1, MUC13, PBLD, TFF2",0.021084636
BP,GO:0002685,regulation of leukocyte migration,"ITGA2, CD9, ECM1, S100A14, CCL20, GREM1, C5, TNFAIP6, ANXA1, MSN, THY1, CXCL8, CXCL10, PLA2G7",0.021745072
BP,GO:0009410,response to xenobiotic stimulus,"ITGA2, CDH3, NQO1, ITGA3, ENO2, EPHX1, NPC1, AHR, AOX1, COL1A1, CDK1, INHBA, SEMA3C, SFRP2, LOX, DPEP1, NNMT, CYP2C18, IGFBP2, SLCO1B3, CYP3A5",0.022040082
BP,GO:0031638,zymogen activation,"PLAU, S100A10, PLAUR, PLAT, F11, KLK1, PRSS3",0.022172611
BP,GO:0061615,glycolytic process through fructose-6-phosphate,"PKM, HK2, ENO2, PFKP",0.022653435
BP,GO:0032102,negative regulation of response to external stimulus,"CD9, PLAU, CD109, FAP, PLAUR, PLAT, OAS1, EPHA4, CEACAM1, GREM1, C5, MMP12, TNFAIP6, NT5E, NUCB2, BACE1, SEMA3C, F11, SERPINB2, TSPAN8, SPP1",0.024280391
BP,GO:0090092,"regulation of transmembrane receptor protein serine, threonine kinase signaling pathway","SULF1, ITGA3, FERMT1, CD109, LTBP1, DKK1, PMEPA1, GREM1, ASPN, TNFAIP6, FBN1, INHBA, SFRP2, LOX, SFRP4, PBLD",0.024534114
BP,GO:0030003,cellular cation homeostasis,"EDNRA, ERO1A, TGM2, MCOLN3, SLC39A10, P2RX1, LCN2, TMPRSS3, FLNA, RGN, MT1G, SLC39A5, MT1M, CP, MT1F, THY1, BNIP3, SCNN1A, CXCL10, SCGN, SLC4A4, CTRC, CFTR",0.024534114
BP,GO:0032964,collagen biosynthetic process,"ITGA2, COL1A1, COL5A1, SERPINH1, PDGFRB, INHBA",0.024534114
BP,GO:0007589,body fluid secretion,"KCNN4, HK2, ANO1, AGR2, NPR3, OAS2, CHRM3, CEL",0.024534114
BP,GO:0046849,bone remodeling,"NOX4, CTHRC1, PDK4, CLDN18, CTSK, GREM1, IAPP, SPP1",0.024534114
BP,GO:0035051,cardiocyte differentiation,"NOX4, EDNRA, EFNB2, DKK1, FHL2, TTN, GREM1, CDK1, PDGFRB, INHBA, SEMA3C",0.025855698
BP,GO:0070570,regulation of neuron projection regeneration,"EPHA4, FLNA, PRRX1, THY1, SPP1",0.025893667
BP,GO:0051591,response to cAMP,"SDC1, AHR, PLAT, COL1A1, IGFBP5, AQP8, DUOX2, CFTR",0.025903546
BP,GO:0051546,keratinocyte migration,"FERMT1, ADAM9, MMP9, EPB41L4B",0.026030693
BP,GO:1990845,adaptive thermogenesis,"MFAP2, NPR3, PLAC8, LCN2, ID1, ESRRG, ACADL, PM20D1, LAMA4, GATM, FABP4",0.026528417
BP,GO:0072503,cellular divalent inorganic cation homeostasis,"EDNRA, ERO1A, TGM2, MCOLN3, SLC39A10, P2RX1, FLNA, RGN, MT1G, SLC39A5, MT1M, MT1F, THY1, BNIP3, CXCL10, SCGN, CTRC",0.027043563
BP,GO:0006939,smooth muscle contraction,"SULF1, ITGA2, EDNRA, COMP, NMU, SULF2, ACTA2, P2RX1, CHRM3",0.027043563
BP,GO:0002548,monocyte chemotaxis,"S100A14, CCL20, GREM1, ANXA1, CXCL10, PLA2G7, CCL18",0.028429089
BP,GO:0002762,negative regulation of myeloid leukocyte differentiation,"CLDN18, CEACAM1, TNFAIP6, FBN1, INHBA, IAPP",0.028429089
BP,GO:0097529,myeloid leukocyte migration,"CD9, S100A14, CCL20, GREM1, C5, TNFAIP6, ANXA1, CXCL5, CXCL8, CXCL10, PLA2G7, CCL18, GP2, PLA2G1B",0.030130079
BP,GO:0006590,thyroid hormone generation,"CTSB, CTSK, SLC16A10, DUOX2",0.030233184
BP,GO:0031960,response to corticosteroid,"SDC1, FBXO32, GJB2, ADAM9, IL1RN, PLAT, COL1A1, ANXA3, ANXA1, SCNN1A, IGFBP2",0.032652378
BP,GO:0018401,peptidyl-proline hydroxylation to 4-hydroxy-L-proline,"ERO1A, P4HA1, EGLN3",0.032745336
BP,GO:0031099,regeneration,"CD9, ANXA3, EPHA4, FLNA, CDK1, RGN, KLF5, ANXA1, PRRX1, THY1, NNMT, SPP1",0.034246133
BP,GO:0007044,cell-substrate junction assembly,"ITGA2, FN1, ITGB4, S100A10, ACTN1, COL17A1, GREM1, THY1",0.034252859
BP,GO:0042058,regulation of epidermal growth factor receptor signaling pathway,"GPRC5A, AGR2, PLAUR, CEACAM1, IFI6, EGF, MMP9",0.034376024
BP,GO:0014074,response to purine-containing compound,"SDC1, AHR, PLAT, COL1A1, P2RX1, IGFBP5, NT5E, AQP8, DUOX2, CFTR",0.034376024
BP,GO:0006734,NADH metabolic process,"PKM, HK2, NQO1, ENO2, PFKP",0.034376024
BP,GO:0044319,wound healing,,
